{
    "$schema": "http://json-schema.org/draft-07/schema#",
    "title": "Generated schema for Root",
    "type": "array",
    "items": {
      "type": "object",
      "properties": {
        "_id": {
          "type": "object",
          "properties": {
            "$oid": {
              "type": "string"
            }
          },
          "required": [
            "$oid"
          ]
        },
        "active": {
          "type": "boolean"
        },
        "createdDate": {
          "type": "object",
          "properties": {
            "$date": {
              "type": "string"
            }
          },
          "required": [
            "$date"
          ]
        },
        "lastLogin": {
          "type": "object",
          "properties": {
            "$date": {
              "type": "string"
            }
          },
          "required": [
            "$date"
          ]
        },
        "role": {
          "type": "string"
        },
        "signUpSource": {
          "type": "string"
        },
        "state": {
          "type": "string"
        }
      },
      "required": [
        "_id",
        "active",
        "createdDate",
        "role"
      ]
    }
  }
  